"term","scientific_context","political_context"
"trans","We studied trans-regulatory elements in gene expression...","Our study included trans participants from marginalized communities..."
"sex","The sex determination pathway in Drosophila involves...","Participants were grouped by sex and gender identity..."
"climate","The climate conditions affected bacterial growth rates...","Climate justice advocates argue that environmental policies..."
"critical","Critical care patients showed improved outcomes...","Critical race theory provides a framework for understanding..."
"equity","The equity theory of motivation suggests that workers...","Equity in healthcare access remains a significant challenge..."
